6042755,Nintendo Switch Mario Red & Blue Edition Konzolbeszámítással,vico84
6076246,Nintendo Switch Játékok /ÚJRATÖLTVE/,NBA
6070100,Nintendo Switch Játékok - BEÁRAZVA!,Ruxin
6075497,"Eladó Luigi's Mansion 3, Mario Tennis Aces Nintendo Switch játékok",63gallon
6075488,Eladó Nintendo Switch V1,63gallon
6072975,Nintendo Switch játékok eladóak.,Lei559
6065484,"Eladó Nintendo Switch játékok: Animal, Dragonball, Bomberman, Mario Maker, Monster Hunter, Pokemon,",sanyi150
6065147,"Eladó 4db nintendo switch játék (Super Mario , Donkey Kong, Minecraft)",hifitibi1974
6045841,ÚJ Pokemon Brilliand Diamond játék + Dialga előrendelői figura egyben eladó - Nintendo Switch,sanyi150
6048752,Nintendo switch v2 keresek játékokkal,szuzyy
6077872,Eladó Nintendo Switch játékok (frissítve: máj. 20),g4bork
6058986,"Super Mario Odyssey (Bontatlan, Új) (Nintendo Switch)",nonamas
6077429,Super Mario Odyssey,zamar
6043149,"Skyrim Nintendo Switch, eladó- cserélhető",psjani
6073731,Super Mario Odyssey - Nintendo Switch játék,tlgergo2001
5933817,SUPER MARIO ITX GAMING PC // Ryzen 9 5950X // 1TB NVMe SSD // PALiT GeForce RTX3090 24GB GAMINGPRO,guncity
